{
  "name": "ns1:timeSeriesResponseType",
  "declaredType": "org.cuahsi.waterml.TimeSeriesResponseType",
  "scope": "javax.xml.bind.JAXBElement$GlobalScope",
  "value": {
    "queryInfo": {
      "queryURL": "http://waterservices.usgs.gov/nwis/dv/format=json&sites=09361500&startDT=2020-09-01&endDT=2020-09-02&parameterCd=00060&siteStatus=all",
      "criteria": {
        "locationParam": "[ALL:09361500]",
        "variableParam": "[00060]",
        "timeParam": {
          "beginDateTime": "2020-09-01T00:00:00.000",
          "endDateTime": "2020-09-02T00:00:00.000"
        },
        "parameter": []
      },
      "note": [
        { "value": "[ALL:09361500]", "title": "filter:sites" },
        {
          "value": "[mode=RANGE, modifiedSince=null] interval={INTERVAL[2020-09-01T00:00:00.000-04:00/2020-09-02T00:00:00.000-04:00]}",
          "title": "filter:timeRange"
        },
        { "value": "methodIds=[ALL]", "title": "filter:methodId" },
        { "value": "2020-12-07T14:35:58.320Z", "title": "requestDT" },
        {
          "value": "855787f0-3899-11eb-91f9-2cea7f5e5ede",
          "title": "requestId"
        },
        {
          "value": "Provisional data are subject to revision. Go to http://waterdata.usgs.gov/nwis/help/?provisional for more information.",
          "title": "disclaimer"
        },
        { "value": "sdas01", "title": "server" }
      ]
    },
    "timeSeries": [
      {
        "sourceInfo": {
          "siteName": "ANIMAS RIVER AT DURANGO, CO",
          "siteCode": [
            { "value": "09361500", "network": "NWIS", "agencyCode": "USGS" }
          ],
          "timeZoneInfo": {
            "defaultTimeZone": {
              "zoneOffset": "-07:00",
              "zoneAbbreviation": "MST"
            },
            "daylightSavingsTimeZone": {
              "zoneOffset": "-06:00",
              "zoneAbbreviation": "MDT"
            },
            "siteUsesDaylightSavingsTime": true
          },
          "geoLocation": {
            "geogLocation": {
              "srs": "EPSG:4326",
              "latitude": 37.2791688,
              "longitude": -107.8803445
            },
            "localSiteXY": []
          },
          "note": [],
          "siteType": [],
          "siteProperty": [
            { "value": "ST", "name": "siteTypeCd" },
            { "value": "14080104", "name": "hucCd" },
            { "value": "08", "name": "stateCd" },
            { "value": "08067", "name": "countyCd" }
          ]
        },
        "variable": {
          "variableCode": [
            {
              "value": "00060",
              "network": "NWIS",
              "vocabulary": "NWIS:UnitValues",
              "variableID": 45807197,
              "default": true
            }
          ],
          "variableName": "Streamflow, ft&#179;/s",
          "variableDescription": "Discharge, cubic feet per second",
          "valueType": "Derived Value",
          "unit": { "unitCode": "ft3/s" },
          "options": {
            "option": [
              { "value": "Mean", "name": "Statistic", "optionCode": "00003" }
            ]
          },
          "note": [],
          "noDataValue": -999999.0,
          "variableProperty": [],
          "oid": "45807197"
        },
        "values": [
          {
            "value": [
              {
                "value": "174",
                "qualifiers": ["P"],
                "dateTime": "2020-09-01T00:00:00.000"
              },
              {
                "value": "168",
                "qualifiers": ["P"],
                "dateTime": "2020-09-02T00:00:00.000"
              }
            ],
            "qualifier": [
              {
                "qualifierCode": "P",
                "qualifierDescription": "Provisional data subject to revision.",
                "qualifierID": 0,
                "network": "NWIS",
                "vocabulary": "uv_rmk_cd"
              }
            ],
            "qualityControlLevel": [],
            "method": [{ "methodDescription": "", "methodID": 19604 }],
            "source": [],
            "offset": [],
            "sample": [],
            "censorCode": []
          }
        ],
        "name": "USGS:09361500:00060:00003"
      }
    ]
  },
  "nil": false,
  "globalScope": true,
  "typeSubstituted": false
}
