{"name":"ns1:timeSeriesResponseType","declaredType":"org.cuahsi.waterml.TimeSeriesResponseType","scope":"javax.xml.bind.JAXBElement$GlobalScope","value":{"queryInfo":{"queryURL":"http://waterservices.usgs.gov/nwis/iv/format=json&sites=09361500,09364500&parameterCd=00060,00010&siteStatus=all","criteria":{"locationParam":"[ALL:09361500, ALL:09364500]","variableParam":"[00060, 00010]","parameter":[]},"note":[{"value":"[ALL:09361500, ALL:09364500]","title":"filter:sites"},{"value":"[mode=LATEST, modifiedSince=null]","title":"filter:timeRange"},{"value":"methodIds=[ALL]","title":"filter:methodId"},{"value":"2020-12-08T15:48:52.919Z","title":"requestDT"},{"value":"df381d60-396c-11eb-becb-2cea7f58f5ca","title":"requestId"},{"value":"Provisional data are subject to revision. Go to http://waterdata.usgs.gov/nwis/help/?provisional for more information.","title":"disclaimer"},{"value":"vaas01","title":"server"}]},"timeSeries":[{"sourceInfo":{"siteName":"ANIMAS RIVER AT DURANGO, CO","siteCode":[{"value":"09361500","network":"NWIS","agencyCode":"USGS"}],"timeZoneInfo":{"defaultTimeZone":{"zoneOffset":"-07:00","zoneAbbreviation":"MST"},"daylightSavingsTimeZone":{"zoneOffset":"-06:00","zoneAbbreviation":"MDT"},"siteUsesDaylightSavingsTime":true},"geoLocation":{"geogLocation":{"srs":"EPSG:4326","latitude":37.2791688,"longitude":-107.8803445},"localSiteXY":[]},"note":[],"siteType":[],"siteProperty":[{"value":"ST","name":"siteTypeCd"},{"value":"14080104","name":"hucCd"},{"value":"08","name":"stateCd"},{"value":"08067","name":"countyCd"}]},"variable":{"variableCode":[{"value":"00010","network":"NWIS","vocabulary":"NWIS:UnitValues","variableID":45807042,"default":true}],"variableName":"Temperature, water, &#176;C","variableDescription":"Temperature, water, degrees Celsius","valueType":"Derived Value","unit":{"unitCode":"deg C"},"options":{"option":[{"name":"Statistic","optionCode":"00000"}]},"note":[],"noDataValue":-999999,"variableProperty":[],"oid":"45807042"},"values":[{"value":[{"value":"2.0","qualifiers":["P"],"dateTime":"2020-12-08T08:30:00.000-07:00"}],"qualifier":[{"qualifierCode":"P","qualifierDescription":"Provisional data subject to revision.","qualifierID":0,"network":"NWIS","vocabulary":"uv_rmk_cd"}],"qualityControlLevel":[],"method":[{"methodDescription":"","methodID":212176}],"source":[],"offset":[],"sample":[],"censorCode":[]}],"name":"USGS:09361500:00010:00000"},{"sourceInfo":{"siteName":"ANIMAS RIVER AT DURANGO, CO","siteCode":[{"value":"09361500","network":"NWIS","agencyCode":"USGS"}],"timeZoneInfo":{"defaultTimeZone":{"zoneOffset":"-07:00","zoneAbbreviation":"MST"},"daylightSavingsTimeZone":{"zoneOffset":"-06:00","zoneAbbreviation":"MDT"},"siteUsesDaylightSavingsTime":true},"geoLocation":{"geogLocation":{"srs":"EPSG:4326","latitude":37.2791688,"longitude":-107.8803445},"localSiteXY":[]},"note":[],"siteType":[],"siteProperty":[{"value":"ST","name":"siteTypeCd"},{"value":"14080104","name":"hucCd"},{"value":"08","name":"stateCd"},{"value":"08067","name":"countyCd"}]},"variable":{"variableCode":[{"value":"00060","network":"NWIS","vocabulary":"NWIS:UnitValues","variableID":45807197,"default":true}],"variableName":"Streamflow, ft&#179;/s","variableDescription":"Discharge, cubic feet per second","valueType":"Derived Value","unit":{"unitCode":"ft3/s"},"options":{"option":[{"name":"Statistic","optionCode":"00000"}]},"note":[],"noDataValue":-999999,"variableProperty":[],"oid":"45807197"},"values":[{"value":[{"value":"110","qualifiers":["P"],"dateTime":"2020-12-08T08:30:00.000-07:00"}],"qualifier":[{"qualifierCode":"P","qualifierDescription":"Provisional data subject to revision.","qualifierID":0,"network":"NWIS","vocabulary":"uv_rmk_cd"}],"qualityControlLevel":[],"method":[{"methodDescription":"","methodID":212173}],"source":[],"offset":[],"sample":[],"censorCode":[]}],"name":"USGS:09361500:00060:00000"},{"sourceInfo":{"siteName":"ANIMAS RIVER AT FARMINGTON, NM","siteCode":[{"value":"09364500","network":"NWIS","agencyCode":"USGS"}],"timeZoneInfo":{"defaultTimeZone":{"zoneOffset":"-07:00","zoneAbbreviation":"MST"},"daylightSavingsTimeZone":{"zoneOffset":"-06:00","zoneAbbreviation":"MDT"},"siteUsesDaylightSavingsTime":true},"geoLocation":{"geogLocation":{"srs":"EPSG:4326","latitude":36.7225,"longitude":-108.20175},"localSiteXY":[]},"note":[],"siteType":[],"siteProperty":[{"value":"ST","name":"siteTypeCd"},{"value":"14080104","name":"hucCd"},{"value":"35","name":"stateCd"},{"value":"35045","name":"countyCd"}]},"variable":{"variableCode":[{"value":"00010","network":"NWIS","vocabulary":"NWIS:UnitValues","variableID":45807042,"default":true}],"variableName":"Temperature, water, &#176;C","variableDescription":"Temperature, water, degrees Celsius","valueType":"Derived Value","unit":{"unitCode":"deg C"},"options":{"option":[{"name":"Statistic","optionCode":"00000"}]},"note":[],"noDataValue":-999999,"variableProperty":[],"oid":"45807042"},"values":[{"value":[{"value":"18.3","qualifiers":["P"],"dateTime":"2020-10-08T16:30:00.000-06:00"}],"qualifier":[{"qualifierCode":"P","qualifierDescription":"Provisional data subject to revision.","qualifierID":0,"network":"NWIS","vocabulary":"uv_rmk_cd"}],"qualityControlLevel":[],"method":[{"methodDescription":"","methodID":101516}],"source":[],"offset":[],"sample":[],"censorCode":[]}],"name":"USGS:09364500:00010:00000"},{"sourceInfo":{"siteName":"ANIMAS RIVER AT FARMINGTON, NM","siteCode":[{"value":"09364500","network":"NWIS","agencyCode":"USGS"}],"timeZoneInfo":{"defaultTimeZone":{"zoneOffset":"-07:00","zoneAbbreviation":"MST"},"daylightSavingsTimeZone":{"zoneOffset":"-06:00","zoneAbbreviation":"MDT"},"siteUsesDaylightSavingsTime":true},"geoLocation":{"geogLocation":{"srs":"EPSG:4326","latitude":36.7225,"longitude":-108.20175},"localSiteXY":[]},"note":[],"siteType":[],"siteProperty":[{"value":"ST","name":"siteTypeCd"},{"value":"14080104","name":"hucCd"},{"value":"35","name":"stateCd"},{"value":"35045","name":"countyCd"}]},"variable":{"variableCode":[{"value":"00060","network":"NWIS","vocabulary":"NWIS:UnitValues","variableID":45807197,"default":true}],"variableName":"Streamflow, ft&#179;/s","variableDescription":"Discharge, cubic feet per second","valueType":"Derived Value","unit":{"unitCode":"ft3/s"},"options":{"option":[{"name":"Statistic","optionCode":"00000"}]},"note":[],"noDataValue":-999999,"variableProperty":[],"oid":"45807197"},"values":[{"value":[{"value":"183","qualifiers":["P"],"dateTime":"2020-12-08T08:30:00.000-07:00"}],"qualifier":[{"qualifierCode":"P","qualifierDescription":"Provisional data subject to revision.","qualifierID":0,"network":"NWIS","vocabulary":"uv_rmk_cd"}],"qualityControlLevel":[],"method":[{"methodDescription":"","methodID":101517}],"source":[],"offset":[],"sample":[],"censorCode":[]}],"name":"USGS:09364500:00060:00000"}]},"nil":false,"globalScope":true,"typeSubstituted":false}